{
  "schema_version": "1.0",
  "case_id": "heldout-candidate-ready-valid-001",
  "task_id": "ready_valid_slice_v1",
  "candidate_origin": "real_hy3",
  "source_run": "runs/held-out/ready-valid-001",
  "source_hashes": {
    "process_sha256": "a1f99ed5f007f0bf5d1aa944fa91af8dcdf00bdca5d1af713efdbc9bea38b71d",
    "evidence_sha256": "633cfcbbc0ceab9df9316b5465f3a47d7e69b4bb842f7347c61d8383827ebfa4",
    "report_sha256": "a6d49e51b0e564f97672e3045e3e313102c3244a630337a7dcaad2c0686710e1"
  },
  "candidate_process": {
    "task_id": "ready_valid_slice_v1",
    "architecture_summary": "Single-entry ready/valid slice with registered out_valid and out_data, combinational in_ready, unified edge-triggered update handling simultaneous in/out transfers.",
    "stages": [
      {
        "id": "S1",
        "title": "Specification Understanding",
        "items": [
          {
            "id": "S1.1",
            "stage": "S1",
            "claim": "Sampled high rst synchronously clears out_valid and zero out_data.",
            "maps_to": [
              "O_RESET"
            ],
            "claimed_dependencies": [],
            "reads": [],
            "writes": [],
            "rtl_blocks": []
          },
          {
            "id": "S1.2",
            "stage": "S1",
            "claim": "in_ready combinationally equals !out_valid || out_ready using current output state.",
            "maps_to": [
              "O_READY"
            ],
            "claimed_dependencies": [],
            "reads": [],
            "writes": [],
            "rtl_blocks": []
          },
          {
            "id": "S1.3",
            "stage": "S1",
            "claim": "Input transfer occurs when in_valid&&in_ready; output transfer when out_valid&&out_ready; simultaneous full transfer replaces entry.",
            "maps_to": [
              "O_INPUT_ACCEPT",
              "O_OUTPUT_ACCEPT",
              "O_REPLACE"
            ],
            "claimed_dependencies": [],
            "reads": [],
            "writes": [],
            "rtl_blocks": []
          },
          {
            "id": "S1.4",
            "stage": "S1",
            "claim": "No combinational bypass: accepted input appears only after edge; out_valid/out_data hold under backpressure; order preserved.",
            "maps_to": [
              "O_BACKPRESSURE",
              "O_NO_BYPASS",
              "O_DRAIN",
              "O_ORDERING"
            ],
            "claimed_dependencies": [],
            "reads": [],
            "writes": [],
            "rtl_blocks": []
          }
        ]
      },
      {
        "id": "S2",
        "title": "Architecture / State Modeling",
        "items": [
          {
            "id": "S2.1",
            "stage": "S2",
            "claim": "Architecture: single-entry slice with registered out_valid and out_data, combinational in_ready, unified edge update handling simultaneous transfers.",
            "maps_to": [
              "O_RESET",
              "O_READY",
              "O_REPLACE"
            ],
            "claimed_dependencies": [
              "S1.1",
              "S1.2",
              "S1.3",
              "S1.4"
            ],
            "reads": [],
            "writes": [
              "out_valid",
              "out_data"
            ],
            "rtl_blocks": [
              "arch"
            ]
          },
          {
            "id": "S2.2",
            "stage": "S2",
            "claim": "State variables: out_valid register (entry occupancy) and out_data register (payload) are the only stored state.",
            "maps_to": [
              "O_RESET",
              "O_NO_BYPASS"
            ],
            "claimed_dependencies": [
              "S2.1"
            ],
            "reads": [],
            "writes": [
              "out_valid",
              "out_data"
            ],
            "rtl_blocks": [
              "seq_update"
            ]
          },
          {
            "id": "S2.3",
            "stage": "S2",
            "claim": "Combinational ready logic: in_ready = !out_valid || out_ready implemented as continuous assign.",
            "maps_to": [
              "O_READY"
            ],
            "claimed_dependencies": [
              "S2.1",
              "S1.2"
            ],
            "reads": [
              "out_valid",
              "out_ready"
            ],
            "writes": [
              "in_ready"
            ],
            "rtl_blocks": [
              "comb_ready"
            ]
          }
        ]
      },
      {
        "id": "S3",
        "title": "Transition & Temporal Rules",
        "items": [
          {
            "id": "S3.1",
            "stage": "S3",
            "claim": "Reset rule: at posedge clk if rst, out_valid<=0 and out_data<=0.",
            "maps_to": [
              "O_RESET"
            ],
            "claimed_dependencies": [
              "S2.2"
            ],
            "reads": [
              "rst"
            ],
            "writes": [
              "out_valid",
              "out_data"
            ],
            "rtl_blocks": [
              "seq_update"
            ]
          },
          {
            "id": "S3.2",
            "stage": "S3",
            "claim": "Fill rule: when entry empty and input accepted, load in_data into out_data and set out_valid.",
            "maps_to": [
              "O_INPUT_ACCEPT",
              "O_NO_BYPASS"
            ],
            "claimed_dependencies": [
              "S2.2",
              "S2.3"
            ],
            "reads": [
              "out_valid",
              "in_valid",
              "in_ready",
              "in_data"
            ],
            "writes": [
              "out_data",
              "out_valid"
            ],
            "rtl_blocks": [
              "seq_update"
            ]
          },
          {
            "id": "S3.3",
            "stage": "S3",
            "claim": "Drain rule: when output consumed and no simultaneous input, out_valid goes low, out_data holds.",
            "maps_to": [
              "O_OUTPUT_ACCEPT",
              "O_DRAIN"
            ],
            "claimed_dependencies": [
              "S2.2",
              "S2.3"
            ],
            "reads": [
              "out_valid",
              "out_ready",
              "in_valid",
              "in_ready"
            ],
            "writes": [
              "out_valid"
            ],
            "rtl_blocks": [
              "seq_update"
            ]
          },
          {
            "id": "S3.4",
            "stage": "S3",
            "claim": "Replace rule: when full and both transfers occur, out_data takes in_data and out_valid stays high.",
            "maps_to": [
              "O_REPLACE"
            ],
            "claimed_dependencies": [
              "S3.2",
              "S3.3"
            ],
            "reads": [
              "out_valid",
              "out_ready",
              "in_valid",
              "in_ready",
              "in_data"
            ],
            "writes": [
              "out_data",
              "out_valid"
            ],
            "rtl_blocks": [
              "seq_update"
            ]
          },
          {
            "id": "S3.5",
            "stage": "S3",
            "claim": "Backpressure rule: when out_valid && !out_ready, state holds and in_ready false blocks input.",
            "maps_to": [
              "O_BACKPRESSURE"
            ],
            "claimed_dependencies": [
              "S2.3",
              "S2.2"
            ],
            "reads": [
              "out_valid",
              "out_ready"
            ],
            "writes": [
              "out_valid",
              "out_data"
            ],
            "rtl_blocks": [
              "seq_update"
            ]
          }
        ]
      },
      {
        "id": "S4",
        "title": "Candidate Properties",
        "items": [
          {
            "id": "S4.1",
            "stage": "S4",
            "claim": "Candidate: in_ready == (!out_valid || out_ready) always holds.",
            "maps_to": [
              "O_READY"
            ],
            "claimed_dependencies": [
              "S2.3"
            ],
            "reads": [
              "in_ready",
              "out_valid",
              "out_ready"
            ],
            "writes": [],
            "rtl_blocks": [
              "comb_ready"
            ]
          },
          {
            "id": "S4.2",
            "stage": "S4",
            "claim": "Candidate: if out_valid && !out_ready then next out_valid==out_valid and out_data unchanged.",
            "maps_to": [
              "O_BACKPRESSURE"
            ],
            "claimed_dependencies": [
              "S3.5"
            ],
            "reads": [
              "out_valid",
              "out_ready",
              "out_data"
            ],
            "writes": [],
            "rtl_blocks": [
              "seq_update"
            ]
          },
          {
            "id": "S4.3",
            "stage": "S4",
            "claim": "Candidate: no combinational path from in_data to out_data (latency 1).",
            "maps_to": [
              "O_NO_BYPASS"
            ],
            "claimed_dependencies": [
              "S3.2"
            ],
            "reads": [
              "in_data",
              "out_data"
            ],
            "writes": [],
            "rtl_blocks": [
              "seq_update"
            ]
          },
          {
            "id": "S4.4",
            "stage": "S4",
            "claim": "Candidate: every accepted input eventually appears on output in order without loss.",
            "maps_to": [
              "O_ORDERING"
            ],
            "claimed_dependencies": [
              "S3.2",
              "S3.3",
              "S3.4"
            ],
            "reads": [
              "in_valid",
              "in_ready",
              "out_valid",
              "out_ready"
            ],